{
    "input": "How did Einstein's Swiss education relocation enable his German citizenship renunciation for conscription?",
    "expectedOutput": "Einstein's relocation to Switzerland for his education directly enabled his renunciation of German citizenship to avoid conscription. In 1895, at the age of sixteen, Einstein moved to Switzerland to pursue his education, initially attempting to enter the federal polytechnic school in Zurich and subsequently completing his secondary education at the Argovian cantonal school in Aarau, from which he graduated in 1896. While he was residing and studying in Switzerland, in January 1896, with his father's approval, he formally renounced his citizenship of the German Kingdom of W\u00fcrttemberg. This decision was made specifically to avoid conscription into military service in Germany, a move facilitated by his physical presence and educational commitments outside of German territory.",
    "context": [
        " then secondary school education.\n\nIn 1894, Hermann and Jakob's company tendered for a contract to install electric lighting in Munich, but without success\u2014they lacked the capital that would have been required to update their technology from direct current to the more efficient, alternating current alternative. The failure of their bid forced them to sell their Munich factory and search for new opportunities elsewhere. The Einstein family moved to Italy, first to Milan and a few months later to Pavia, where they settled in Palazzo Cornazzani. Einstein, then fifteen, stayed behind in Munich in order to finish his schooling. His father wanted him to study electrical engineering, but he was a fractious pupil who found the Gymnasium's regimen and teaching methods far from congenial. He later wrote that the school's policy of strict rote learning was harmful to creativity. At the end of December 1894, a letter from a doctor persuaded the Luitpold's authorities to release him from its care, and he joined his family in Pavia. While in Italy as a teenager, he wrote an essay entitled \"On the Investigation of the State of the Ether in a Magnetic Field\".\nEinstein excelled at physics and mathematics from an early age, and soon acquired the mathematical expertise normally only found in a child several years his senior. He began teaching himself algebra, calculus and Euclidean geometry when he was twelve; he made such rapid progress that he discovered an original proof of the Pythagorean theorem before his thirteenth birthday. A family tutor, Max Talmud, said that only a short time after he had given the twelve year old Einstein a geometry textbook, the boy \"had worked through the whole book. He thereupon devoted himself to higher mathematics ... Soon the flight of his mathematical genius was so high I could not follow.\" Einstein recorded that he had \"mastered integral and differential calculus\" while still just fourteen. His love of algebra and geometry was so great that at twelve, he was already confident that nature could be understood as a \"mathematical structure\".\n\nAt thirteen, when his range of enthusiasms had broadened to include music and philosophy, Talmud introduced Einstein to Kant's Critique of Pure Reason. Kant became his favorite philosopher; according to Talmud, \"At the time he was still a child, only thirteen years old, yet Kant's works, incomprehensible to ordinary mortals, seemed to be clear to him.\"\nIn 1895, at the age of sixteen, Einstein sat the entrance examination for the federal polytechnic school (later the Eidgen\u00f6ssische Technische Hochschule, ETH) in Zurich, Switzerland. He failed to reach the required standard in the general part of the test, but performed with distinction in physics and mathematics. On the advice of the polytechnic's principal, he completed his secondary education at the Argovian cantonal school (a gymnasium) in Aarau, Switzerland, graduating in 1896. While lodging in Aarau with the family of Jost Winteler, he fell in love with Winteler's daughter, Marie. (His sister, Maja, later married Winteler's son Paul.)\n\nIn January 1896, with his father's approval, Einstein renounced his citizenship of the German Kingdom of W\u00fcrttemberg in order to avoid conscription into military service. The Matura (graduation for the successful completion of higher secondary schooling), awarded to him in September 1896, acknowledged him to have performed well across most of the curriculum, allotting him a top grade of 6 for history, physics, algebra, geometry, and descriptive geometry. At seventeen, he enrolled in the four-year mathematics and physics teaching diploma program at the federal polytechnic school. He befriended fellow student Marcel Grossmann, who would help him there to get by despite his loose study habits, and later to mathematically underpin his revolutionary insights into physics. Marie Winteler, a year older than him, took up a teaching post in Olsberg, Switzerland.\nThe five other polytechnic school freshmen following the same course as Einstein included just one woman, a twenty year old Serbian, Mileva Mari\u0107. Over the next few years, the pair spent many hours discussing their shared interests and learning about topics in physics that the polytechnic school's lectures did not cover. In his letters to Mari\u0107, Einstein confessed that exploring science with her by his side was much more enjoyable than reading a textbook in solitude. Eventually the two students became not only friends but also lovers.\nHistorians of physics are divided on the question of the extent to which Mari\u0107 contributed to the insights of Einstein's annus mirabilis publications. There is at least some evidence that he was influenced by her scientific ideas, but there are scholars who doubt whether her impact on his thought was of any great significance at all.\n\nMarriages, relationships and children\nCorrespondence between Einstein and Mari\u0107, discovered and published in 1987, revealed that in early 1902",
        "Correspondence between Einstein and Mari\u0107, discovered and published in 1987, revealed that in early 1902, while Mari\u0107 was visiting her parents in Novi Sad, she gave birth to a daughter, Lieserl. When Mari\u0107 returned to Switzerland it was without the child, whose fate is uncertain. A letter of Einstein's that he wrote in September 1903 suggests that the girl was either given up for adoption or died of scarlet fever in infancy.\nEinstein and Mari\u0107 married in January 1903. In May 1904, their son Hans Albert was born in Bern, Switzerland. Their son Eduard was born in Zurich in July 1910. In letters that Einstein wrote to Marie Winteler in the months before Eduard's arrival, he described his love for his wife as \"misguided\" and mourned the \"missed life\" that he imagined he would have enjoyed if he had married Winteler instead: \"I think of you in heartfelt love every spare minute and am so unhappy as only a man can be.\"\n\nIn 1912, Einstein entered into a relationship with Elsa L\u00f6wenthal, who was both his first cousin on his mother's side and his second cousin on his father's. When Mari\u0107 learned of his infidelity soon after moving to Berlin with him in April 1914, she returned to Zurich, taking Hans Albert and Eduard with her. Einstein and Mari\u0107 were granted a divorce on 14 February 1919 on the grounds of having lived apart for five years. As part of the divorce settlement, Einstein agreed that if he were to win a Nobel Prize, he would give the money that he received to Mari\u0107; he won the prize two years later.\nEinstein married L\u00f6wenthal in 1919. In 1923, he began a relationship with a secretary named Betty Neumann, the niece of his close friend Hans M\u00fchsam. L\u00f6wenthal nevertheless remained loyal to him, accompanying him when he emigrated to the United States in 1933. In 1935, she was diagnosed with heart and kidney problems. She died in December 1936.\n\nA volume of Einstein's letters released by Hebrew University of Jerusalem in 2006 added some other women with whom he was romantically involved. They included Margarete Lebach (a married Austrian), Estella Katzenellenbogen (the rich owner of a florist business), Toni Mendel (a wealthy Jewish widow) and Ethel Michanowski (a Berlin socialite), with whom he spent time and from whom he accepted gifts while married to L\u00f6wenthal. After being widowed, Einstein was briefly in a relationship with Margarita Konenkova, thought by some to be a Russian spy; her husband, the Russian sculptor Sergei Konenkov, created the bronze bust of Einstein at the Institute for Advanced Study at Princeton.\nFollowing an episode of acute mental illness at about the age of twenty, Einstein's son Eduard was diagnosed with schizophrenia. He spent the remainder of his life either in the care of his mother or in temporary confinement in an asylum. After her death, he was committed permanently to Burgh\u00f6lzli, the Psychiatric University Hospital in Zurich.\n\nAssistant at the Swiss Patent Office (1902\u20131909)\nEinstein graduated from the federal polytechnic school in 1900, duly certified as competent to teach mathematics and physics. His successful acquisition of Swiss citizenship in February 1901 was not followed by the usual sequel of conscription; the Swiss authorities deemed him medically unfit for military service. He found that Swiss schools too appeared to have no use for him, failing to offer him a teaching position despite the almost two years that he spent applying for one. Eventually it was with the help of Marcel Grossmann's father that he secured a post in Bern at the Swiss Patent Office, as an assistant examiner \u2013 level III.\nPatent applications that landed on Einstein's desk for his evaluation included ideas for a gravel sorter and an electric typewriter. His employers were pleased enough with his work to make his position permanent in 1903, although they did not think that he should be promoted until he had \"fully mastered machine technology\". It is conceivable that his labors at the patent office had a bearing on his development of his special theory of relativity. He arrived at his revolutionary ideas about space, time and light through thought experiments about the transmission of signals and the synchronization of clocks, matters which also figured in some of the inventions submitted to him for assessment.\nIn 1902, Einstein and some friends whom he had met in Bern formed a group that held regular meetings to discuss science and philosophy. Their choice of a name for their club, the Olympia Academy, was an ironic comment upon its far from Olympian status. Sometimes they were joined by Mari\u0107, who limited her participation in their proceedings to careful listening. The thinkers whose works they reflected upon included Henri Poincar\u00e9, Ernst Mach and David Hume, all of whom significantly influenced Einstein's own subsequent ideas and beliefs.\n\nFirst scientific papers (1900\u20131905)\nEinstein's first",
        "# Albert Einstein\n\nSource: https://en.wikipedia.org/wiki/Albert_Einstein\n\nAlbert Einstein (14 March 1879 \u2013 18 April 1955) was a German-born theoretical physicist best known for developing the theory of relativity. Einstein also made important contributions to quantum theory. His mass\u2013energy equivalence formula E = mc2, which arises from special relativity, has been called \"the world's most famous equation\". He received the 1921 Nobel Prize in Physics for \"his services to theoretical physics, and especially for his discovery of the law of the photoelectric effect\".\nBorn in the German Empire, Einstein moved to Switzerland in 1895, forsaking his German citizenship (as a subject of the Kingdom of W\u00fcrttemberg) the following year. In 1897, at the age of seventeen, he enrolled in the mathematics and physics teaching diploma program at the Swiss federal polytechnic school in Zurich, graduating in 1900. He acquired Swiss citizenship a year later, which he kept for the rest of his life, and afterwards secured a permanent position at the Swiss Patent Office in Bern. In 1905, he submitted a successful PhD dissertation to the University of Zurich. In 1914, he moved to Berlin to join the Prussian Academy of Sciences and the Humboldt University of Berlin, becoming director of the Kaiser Wilhelm Institute for Physics in 1917; he also became a German citizen again, this time as a subject of the Kingdom of Prussia. In 1933, while Einstein was visiting the United States, Adolf Hitler came to power in Germany. Horrified by the Nazi persecution of his fellow Jews, he decided to remain in the US, and was granted American citizenship in 1940. On the eve of World War II, he endorsed a letter to President Franklin D. Roosevelt alerting him to the potential German nuclear weapons program and recommending that the US begin similar research, later carried out as the Manhattan Project.\nIn 1905, sometimes described as his annus mirabilis (miracle year), he published four groundbreaking papers. In them, he outlined a theory of the photoelectric effect, explained Brownian motion, introduced his special theory of relativity, and demonstrated that if the special theory is correct, mass and energy are equivalent to each other. In 1915, he proposed a general theory of relativity that extended his system of mechanics to incorporate gravitation. A paper that he published the following year laid out the implications of general relativity for the modeling of the structure and evolution of the universe as a whole. It introduced the cosmological constant and is further regarded as the first step in the field of modern theoretical cosmology. In 1917, Einstein wrote a paper which introduced the concepts of spontaneous emission and stimulated emission, the latter of which is the core mechanism behind the laser and maser, and which contained a trove of information that would be beneficial to developments in physics later on, such as quantum electrodynamics and quantum optics.\nIn the middle part of his career, Einstein made important contributions to statistical mechanics and quantum theory. Especially notable was his work on the quantum physics of radiation, in which light consists of particles, subsequently called photons. With physicist Satyendra Nath Bose, he laid the groundwork for Bose\u2013Einstein statistics. For much of the last phase of his academic life, Einstein worked on two endeavors that ultimately proved unsuccessful. First, he advocated against quantum theory's introduction of fundamental randomness into science's picture of the world, objecting that \"God does not play dice\". Second, he attempted to devise a unified field theory by generalizing his geometric theory of gravitation to include electromagnetism. As a result, he became increasingly isolated from mainstream modern physics. Many  things are named after him, including the element Einsteinium. In 1999, he was named Time's  Person of the Century.\n\nLife and career\nChildhood, youth and education\nAlbert Einstein was born in Ulm, in the Kingdom of W\u00fcrttemberg in the German Empire, on 14 March 1879. His parents, secular Ashkenazi Jews, were Hermann Einstein, a salesman and engineer, and Pauline Koch. In 1880, the family moved to Munich's borough of Ludwigsvorstadt-Isarvorstadt, where Einstein's father and his uncle Jakob founded Elektrotechnische Fabrik J. Einstein & Cie, a company that manufactured electrical equipment based on direct current.\nWhen he was very young, his parents worried that he had a learning disability because he was very slow to learn to talk. When he was five and sick in bed, his father brought him a compass. This sparked his lifelong fascination with electromagnetism. He realized that \"Something deeply hidden had to be behind things.\"\nEinstein attended St. Peter's Catholic elementary school in Munich from the age of five. When he was eight, he was transferred to the Luitpold Gymnasium, where he received advanced primary and then secondary school education.\n\nIn 1894, Hermann and Jakob's company tendered"
    ],
    "additionalMetadata": {
        "evolutions": [
            "Reasoning",
            "Reasoning"
        ],
        "synthetic_input_quality": 1.0,
        "context_quality": 0.9249999999999999
    },
    "sourceFile": "data/wikipedia/files/Albert_Einstein.md",
    "actual_output": "Einstein moved to Switzerland in 1895. The following year, in January 1896, he renounced his citizenship of the German Kingdom of W\u00fcrttemberg with his father's approval to avoid conscription into military service [Albert_Einstein.md - Chunk #1, Albert_Einstein.md - Chunk #8]. He then enrolled in the mathematics and physics teaching diploma program at the Swiss federal polytechnic school in Zurich in 1897 [Albert_Einstein.md - Chunk #1].",
    "retrieval_contexts": [
        {
            "content": "Born in the German Empire, Einstein moved to Switzerland in 1895, forsaking his German citizenship (as a subject of the Kingdom of W\u00fcrttemberg) the following year. In 1897, at the age of seventeen, he enrolled in the mathematics and physics teaching diploma program at the Swiss federal polytechnic school in Zurich, graduating in 1900. He acquired Swiss citizenship a year later, which he kept for the rest of his life, and afterwards secured a permanent position at the Swiss Patent Office in Bern. In 1905, he submitted a successful PhD dissertation to the University of Zurich. In 1914, he moved to Berlin to join the Prussian Academy of Sciences and the Humboldt University of Berlin, becoming director of the Kaiser Wilhelm Institute for Physics in 1917; he also became a German citizen again, this time as a subject of the Kingdom of Prussia. In 1933, while Einstein was visiting the United States, Adolf Hitler came to power in Germany. Horrified by the Nazi persecution of his fellow Jews, he decided to remain in the US, and was granted American citizenship in 1940. On the eve of World War II, he endorsed a letter to President Franklin D. Roosevelt alerting him to the potential German nuclear weapons program and recommending that the US begin similar research, later carried out as the Manhattan",
            "source": "Albert_Einstein.md - Chunk #1",
            "score": 0.69242096
        },
        {
            "content": "Assistant at the Swiss Patent Office (1902\u20131909)\nEinstein graduated from the federal polytechnic school in 1900, duly certified as competent to teach mathematics and physics. His successful acquisition of Swiss citizenship in February 1901 was not followed by the usual sequel of conscription; the Swiss authorities deemed him medically unfit for military service. He found that Swiss schools too appeared to have no use for him, failing to offer him a teaching position despite the almost two years that he spent applying for one. Eventually it was with the help of Marcel Grossmann's father that he secured a post in Bern at the Swiss Patent Office, as an assistant examiner \u2013 level III.",
            "source": "Albert_Einstein.md - Chunk #13",
            "score": 0.6688137
        },
        {
            "content": "In January 1896, with his father's approval, Einstein renounced his citizenship of the German Kingdom of W\u00fcrttemberg in order to avoid conscription into military service. The Matura (graduation for the successful completion of higher secondary schooling), awarded to him in September 1896, acknowledged him to have performed well across most of the curriculum, allotting him a top grade of 6 for history, physics, algebra, geometry, and descriptive geometry. At seventeen, he enrolled in the four-year mathematics and physics teaching diploma program at the federal polytechnic school. He befriended fellow student Marcel Grossmann, who would help him there to get by despite his loose study habits, and later to mathematically underpin his revolutionary insights into physics. Marie Winteler, a year older than him, took up a teaching post in Olsberg, Switzerland.",
            "source": "Albert_Einstein.md - Chunk #8",
            "score": 0.6624626
        },
        {
            "content": "Life and career\nChildhood, youth and education\nAlbert Einstein was born in Ulm, in the Kingdom of W\u00fcrttemberg in the German Empire, on 14 March 1879. His parents, secular Ashkenazi Jews, were Hermann Einstein, a salesman and engineer, and Pauline Koch. In 1880, the family moved to Munich's borough of Ludwigsvorstadt-Isarvorstadt, where Einstein's father and his uncle Jakob founded Elektrotechnische Fabrik J. Einstein & Cie, a company that manufactured electrical equipment based on direct current.\nWhen he was very young, his parents worried that he had a learning disability because he was very slow to learn to talk. When he was five and sick in bed, his father brought him a compass. This sparked his lifelong fascination with electromagnetism. He realized that \"Something deeply hidden had to be behind things.\"\nEinstein attended St. Peter's Catholic elementary school in Munich from the age of five. When he was eight, he was transferred to the Luitpold Gymnasium, where he received advanced primary and then secondary school education.",
            "source": "Albert_Einstein.md - Chunk #4",
            "score": 0.5721942
        },
        {
            "content": "Emigration to the US (1933)\nIn February 1933, while on a visit to the United States, Einstein knew he could not return to Germany with the rise to power of the Nazis under Germany's new chancellor, Adolf Hitler.\nWhile at American universities in early 1933, he undertook his third two-month visiting professorship at the California Institute of Technology in Pasadena. In February and March 1933, the Gestapo repeatedly raided his family's apartment in Berlin. He and his wife Elsa returned to Europe in March, and during the trip, they learned that the German Reichstag had passed the Enabling Act on 23 March, transforming Hitler's government into a de facto legal dictatorship, and that they would not be able to proceed to Berlin. Later on, they heard that their cottage had been raided by the Nazis and Einstein's personal sailboat confiscated. Upon landing in Antwerp, Belgium on 28 March, Einstein immediately went to the German consulate and surrendered his passport, formally renouncing his German citizenship. The Nazis later sold his boat and converted his cottage into a Hitler Youth camp.",
            "source": "Albert_Einstein.md - Chunk #32",
            "score": 0.54701823
        }
    ],
    "metrics": {
        "Answer Relevancy": {
            "score": 1.0,
            "reason": "The score is 1.00 because the response stayed completely on topic and directly addressed the complex relationship between Einstein's move to Switzerland for education and how this enabled him to renounce his German citizenship to avoid military conscription. No irrelevant information was included - excellent focus!",
            "threshold": 0.5,
            "is_successful": true,
            "verdicts": [
                {
                    "verdict": "yes",
                    "reason": null
                },
                {
                    "verdict": "yes",
                    "reason": null
                },
                {
                    "verdict": "idk",
                    "reason": "While this statement provides information about Einstein's education in Switzerland, it occurs after his citizenship renunciation and doesn't directly explain how the relocation enabled the renunciation for conscription purposes"
                }
            ],
            "token_usage": {
                "prompt_tokens": 274,
                "completion_tokens": 70,
                "cache_creation_input_tokens": 0,
                "cache_read_input_tokens": 0,
                "turn_name": null,
                "model_name": "apac.anthropic.claude-sonnet-4-20250514-v1:0"
            }
        },
        "Faithfulness": {
            "score": 1.0,
            "reason": "The score is 1.00 because there are no contradictions found, indicating the actual output is perfectly aligned with the retrieval context.",
            "threshold": 0.5,
            "is_successful": true,
            "verdicts": [
                {
                    "verdict": "yes",
                    "reason": null
                },
                {
                    "verdict": "idk",
                    "reason": "The context states that Einstein forsook his German citizenship as a subject of the Kingdom of W\u00fcrttemberg in 1896, but does not specify it was in January or mention his father's approval or that it was specifically to avoid military conscription."
                },
                {
                    "verdict": "yes",
                    "reason": null
                }
            ],
            "token_usage": {
                "prompt_tokens": 277,
                "completion_tokens": 46,
                "cache_creation_input_tokens": 0,
                "cache_read_input_tokens": 0,
                "turn_name": null,
                "model_name": "apac.anthropic.claude-sonnet-4-20250514-v1:0"
            }
        },
        "Contextual Precision": {
            "score": 0.8333333333333333,
            "reason": "The score is 0.83 because while the most relevant nodes are ranked at the top, there are some irrelevant nodes mixed in the middle rankings that should be positioned lower. The first node in retrieval contexts effectively addresses the connection with 'moved to Switzerland in 1895, forsaking his German citizenship (as a subject of the Kingdom of W\u00fcrttemberg) the following year,' and the third node directly explains the conscription avoidance aspect with 'Einstein renounced his citizenship of the German Kingdom of W\u00fcrttemberg in order to avoid conscription into military service.' However, the second node, which mentions Swiss citizenship acquisition but doesn't directly address the connection between his initial move to Switzerland and his German citizenship renunciation to avoid conscription, is ranked higher than it should be. The fourth and fifth nodes appropriately rank lower as they cover his early childhood education in Germany and his later 1933 citizenship renunciation respectively, which are not directly relevant to the specific 1895-1896 relocation and conscription avoidance question.",
            "threshold": 0.5,
            "is_successful": true,
            "verdicts": [
                {
                    "verdict": "yes",
                    "reason": "This document provides key information about Einstein's move to Switzerland in 1895 and his renunciation of German citizenship 'the following year' (1896), directly addressing the connection between his Swiss relocation and citizenship renunciation. It states he 'moved to Switzerland in 1895, forsaking his German citizenship (as a subject of the Kingdom of W\u00fcrttemberg) the following year.'"
                },
                {
                    "verdict": "no",
                    "reason": "While this document mentions Einstein's Swiss citizenship acquisition and notes that 'the Swiss authorities deemed him medically unfit for military service,' it doesn't directly address the connection between his initial move to Switzerland and his German citizenship renunciation to avoid conscription."
                },
                {
                    "verdict": "yes",
                    "reason": "This document directly addresses the core question by stating 'In January 1896, with his father's approval, Einstein renounced his citizenship of the German Kingdom of W\u00fcrttemberg in order to avoid conscription into military service.' It also mentions his educational progress and enrollment 'At seventeen, he enrolled in the four-year mathematics and physics teaching diploma program at the federal polytechnic school.'"
                },
                {
                    "verdict": "no",
                    "reason": "This document provides background information about Einstein's birth and early childhood education in Germany, including that he 'was born in Ulm, in the Kingdom of W\u00fcrttemberg' and his early schooling, but does not address his move to Switzerland or citizenship renunciation."
                },
                {
                    "verdict": "no",
                    "reason": "This document discusses Einstein's later renunciation of German citizenship in 1933 during the Nazi period, stating he 'immediately went to the German consulate and surrendered his passport, formally renouncing his German citizenship.' However, this is a different event from the 1896 renunciation related to avoiding conscription."
                }
            ],
            "token_usage": {
                "prompt_tokens": 872,
                "completion_tokens": 233,
                "cache_creation_input_tokens": 0,
                "cache_read_input_tokens": 0,
                "turn_name": null,
                "model_name": "apac.anthropic.claude-sonnet-4-20250514-v1:0"
            }
        },
        "Contextual Recall": {
            "score": 0.75,
            "reason": "The score is 0.75 because most key facts are well-supported by nodes in retrieval context, particularly Einstein's 1895 move to Switzerland (node 1) and his January 1896 citizenship renunciation to avoid conscription (node 3), which covers the main claims in sentences 1, 3, and 4. However, sentence 2 contains specific educational details about his initial polytechnic attempt, attendance at Argovian cantonal school in Aarau, and 1896 graduation that are not found in the retrieval context, preventing a perfect score.",
            "threshold": 0.5,
            "is_successful": true,
            "verdicts": [
                {
                    "verdict": "yes",
                    "reason": "1st node states 'Einstein moved to Switzerland in 1895' and 3rd node confirms 'In January 1896, with his father's approval, Einstein renounced his citizenship of the German Kingdom of W\u00fcrttemberg in order to avoid conscription into military service.'"
                },
                {
                    "verdict": "no",
                    "reason": "1st node mentions 'Einstein moved to Switzerland in 1895' and 'enrolled in the mathematics and physics teaching diploma program at the Swiss federal polytechnic school in Zurich'. However, the specific details about initially attempting to enter in 1895, attending Argovian cantonal school in Aarau, and graduating in 1896 are not found in the retrieval context."
                },
                {
                    "verdict": "yes",
                    "reason": "3rd node directly states 'In January 1896, with his father's approval, Einstein renounced his citizenship of the German Kingdom of W\u00fcrttemberg' which matches the sentence content."
                },
                {
                    "verdict": "yes",
                    "reason": "3rd node confirms 'Einstein renounced his citizenship of the German Kingdom of W\u00fcrttemberg in order to avoid conscription into military service' which supports the decision being made to avoid conscription, though the phrase 'facilitated by his physical presence and educational commitments outside of German territory' is not explicitly stated."
                }
            ],
            "token_usage": {
                "prompt_tokens": 787,
                "completion_tokens": 141,
                "cache_creation_input_tokens": 0,
                "cache_read_input_tokens": 0,
                "turn_name": null,
                "model_name": "apac.anthropic.claude-sonnet-4-20250514-v1:0"
            }
        },
        "Contextual Relevancy": {
            "score": 0.3125,
            "reason": "The score is 0.31 because while the retrieval context contains some directly relevant information such as 'Einstein renounced his citizenship of the German Kingdom of W\u00fcrttemberg in order to avoid conscription into military service' and details about his Swiss education enrollment, the majority of the context consists of irrelevant biographical details including information about his later life in America, work at the patent office, family background, childhood development, and Nazi persecution - none of which directly address how his Swiss education relocation enabled his German citizenship renunciation for conscription purposes.",
            "threshold": 0.5,
            "is_successful": false,
            "verdicts": [
                {
                    "verdicts": [
                        {
                            "statement": "Einstein moved to Switzerland in 1895 and forsook his German citizenship (as a subject of the Kingdom of W\u00fcrttemberg) the following year in 1896",
                            "verdict": "yes",
                            "reason": null
                        },
                        {
                            "statement": "In 1897, at age seventeen, Einstein enrolled in the mathematics and physics teaching diploma program at the Swiss federal polytechnic school in Zurich, graduating in 1900",
                            "verdict": "yes",
                            "reason": null
                        },
                        {
                            "statement": "Einstein acquired Swiss citizenship in 1901, which he kept for the rest of his life",
                            "verdict": "yes",
                            "reason": null
                        },
                        {
                            "statement": "Einstein secured a permanent position at the Swiss Patent Office in Bern",
                            "verdict": "yes",
                            "reason": null
                        },
                        {
                            "statement": "In 1905, Einstein submitted a successful PhD dissertation to the University of Zurich",
                            "verdict": "no",
                            "reason": "The information about Einstein submitting 'a successful PhD dissertation to the University of Zurich' in 1905 is not directly relevant to how his Swiss education relocation enabled his German citizenship renunciation for conscription purposes."
                        },
                        {
                            "statement": "In 1914, Einstein moved to Berlin to join the Prussian Academy of Sciences and became director of the Kaiser Wilhelm Institute for Physics in 1917, also becoming a German citizen again as a subject of the Kingdom of Prussia",
                            "verdict": "no",
                            "reason": "The information about Einstein moving 'to Berlin to join the Prussian Academy of Sciences' and becoming 'director of the Kaiser Wilhelm Institute for Physics in 1917' and becoming 'a German citizen again' is not relevant to how his Swiss education relocation enabled his German citizenship renunciation for conscription."
                        },
                        {
                            "statement": "In 1933, Einstein decided to remain in the US due to Nazi persecution and was granted American citizenship in 1940",
                            "verdict": "no",
                            "reason": "The information about Einstein deciding 'to remain in the US' in 1933 due to 'Nazi persecution' and being 'granted American citizenship in 1940' is not relevant to how his Swiss education relocation enabled his German citizenship renunciation for conscription."
                        },
                        {
                            "statement": "Einstein endorsed a letter to President Franklin D. Roosevelt about the potential German nuclear weapons program and recommending US research that became the Manhattan Project",
                            "verdict": "no",
                            "reason": "The information about Einstein endorsing 'a letter to President Franklin D. Roosevelt alerting him to the potential German nuclear weapons program' and the 'Manhattan' project is not relevant to how his Swiss education relocation enabled his German citizenship renunciation for conscription."
                        }
                    ]
                },
                {
                    "verdicts": [
                        {
                            "statement": "Einstein graduated from the federal polytechnic school in 1900, duly certified as competent to teach mathematics and physics.",
                            "verdict": "yes",
                            "reason": null
                        },
                        {
                            "statement": "Einstein acquired Swiss citizenship in February 1901.",
                            "verdict": "yes",
                            "reason": null
                        },
                        {
                            "statement": "Einstein's acquisition of Swiss citizenship was not followed by conscription as the Swiss authorities deemed him medically unfit for military service.",
                            "verdict": "yes",
                            "reason": null
                        },
                        {
                            "statement": "Swiss schools failed to offer Einstein a teaching position despite almost two years of applications.",
                            "verdict": "no",
                            "reason": "The statement about 'Swiss schools failed to offer Einstein a teaching position despite almost two years of applications' is not directly relevant to how his Swiss education relocation enabled German citizenship renunciation for conscription."
                        },
                        {
                            "statement": "Einstein secured a post at the Swiss Patent Office in Bern as an assistant examiner with help from Marcel Grossmann's father.",
                            "verdict": "no",
                            "reason": "The information about 'secured a post at the Swiss Patent Office in Bern as an assistant examiner with help from Marcel Grossmann's father' does not relate to how his Swiss education enabled German citizenship renunciation for conscription."
                        }
                    ]
                },
                {
                    "verdicts": [
                        {
                            "statement": "In January 1896, with his father's approval, Einstein renounced his citizenship of the German Kingdom of W\u00fcrttemberg in order to avoid conscription into military service.",
                            "verdict": "yes",
                            "reason": null
                        },
                        {
                            "statement": "The Matura (graduation for the successful completion of higher secondary schooling), awarded to him in September 1896, acknowledged him to have performed well across most of the curriculum, allotting him a top grade of 6 for history, physics, algebra, geometry, and descriptive geometry.",
                            "verdict": "yes",
                            "reason": null
                        },
                        {
                            "statement": "At seventeen, he enrolled in the four-year mathematics and physics teaching diploma program at the federal polytechnic school.",
                            "verdict": "yes",
                            "reason": null
                        },
                        {
                            "statement": "He befriended fellow student Marcel Grossmann, who would help him there to get by despite his loose study habits, and later to mathematically underpin his revolutionary insights into physics.",
                            "verdict": "no",
                            "reason": "The information about befriending Marcel Grossmann and his later help with revolutionary insights into physics is not directly related to how Einstein's Swiss education enabled his German citizenship renunciation for conscription."
                        },
                        {
                            "statement": "Marie Winteler, a year older than him, took up a teaching post in Olsberg, Switzerland.",
                            "verdict": "no",
                            "reason": "The information about 'Marie Winteler, a year older than him, took up a teaching post in Olsberg, Switzerland' is not relevant to Einstein's citizenship renunciation or conscription avoidance."
                        }
                    ]
                },
                {
                    "verdicts": [
                        {
                            "statement": "Albert Einstein was born in Ulm, in the Kingdom of W\u00fcrttemberg in the German Empire, on 14 March 1879.",
                            "verdict": "no",
                            "reason": "The statement about Einstein being 'born in Ulm, in the Kingdom of W\u00fcrttemberg in the German Empire, on 14 March 1879' is not relevant to how his Swiss education relocation enabled German citizenship renunciation for conscription."
                        },
                        {
                            "statement": "His parents, secular Ashkenazi Jews, were Hermann Einstein, a salesman and engineer, and Pauline Koch.",
                            "verdict": "no",
                            "reason": "The information about his parents being 'secular Ashkenazi Jews' and their names and occupations is not relevant to the question about Swiss education relocation and German citizenship renunciation for conscription."
                        },
                        {
                            "statement": "In 1880, the family moved to Munich's borough of Ludwigsvorstadt-Isarvorstadt, where Einstein's father and his uncle Jakob founded Elektrotechnische Fabrik J. Einstein & Cie, a company that manufactured electrical equipment based on direct current.",
                            "verdict": "no",
                            "reason": "The statement about the family moving 'to Munich's borough of Ludwigsvorstadt-Isarvorstadt' and the founding of 'Elektrotechnische Fabrik J. Einstein & Cie, a company that manufactured electrical equipment' is not relevant to Swiss education relocation and German citizenship renunciation for conscription."
                        },
                        {
                            "statement": "When he was very young, his parents worried that he had a learning disability because he was very slow to learn to talk.",
                            "verdict": "no",
                            "reason": "The information about his parents worrying 'that he had a learning disability because he was very slow to learn to talk' is not relevant to the question about Swiss education relocation and German citizenship renunciation for conscription."
                        },
                        {
                            "statement": "When he was five and sick in bed, his father brought him a compass. This sparked his lifelong fascination with electromagnetism.",
                            "verdict": "no",
                            "reason": "The story about his father bringing him 'a compass' and it sparking 'his lifelong fascination with electromagnetism' is not relevant to Swiss education relocation and German citizenship renunciation for conscription."
                        },
                        {
                            "statement": "Einstein attended St. Peter's Catholic elementary school in Munich from the age of five.",
                            "verdict": "no",
                            "reason": "The information about Einstein attending 'St. Peter's Catholic elementary school in Munich' is not relevant to Swiss education relocation and German citizenship renunciation for conscription as it describes his education in Germany, not Switzerland."
                        },
                        {
                            "statement": "When he was eight, he was transferred to the Luitpold Gymnasium, where he received advanced primary and then secondary school education.",
                            "verdict": "no",
                            "reason": "The statement about being 'transferred to the Luitpold Gymnasium' for education is not relevant to the question about Swiss education relocation and German citizenship renunciation for conscription as it describes his German education, not Swiss relocation."
                        }
                    ]
                },
                {
                    "verdicts": [
                        {
                            "statement": "In February 1933, while on a visit to the United States, Einstein knew he could not return to Germany with the rise to power of the Nazis under Germany's new chancellor, Adolf Hitler.",
                            "verdict": "no",
                            "reason": "This statement mentions Einstein's realization about not returning to Germany due to Nazi rise to power, but contains no information about 'Swiss education relocation' or 'conscription' as asked in the input."
                        },
                        {
                            "statement": "Einstein undertook his third two-month visiting professorship at the California Institute of Technology in Pasadena in early 1933.",
                            "verdict": "no",
                            "reason": "This statement about Einstein's 'visiting professorship at the California Institute of Technology' is unrelated to Swiss education relocation or conscription."
                        },
                        {
                            "statement": "In February and March 1933, the Gestapo repeatedly raided his family's apartment in Berlin.",
                            "verdict": "no",
                            "reason": "This statement about 'Gestapo raids' has nothing to do with Swiss education relocation or conscription."
                        },
                        {
                            "statement": "The German Reichstag passed the Enabling Act on 23 March, transforming Hitler's government into a de facto legal dictatorship.",
                            "verdict": "no",
                            "reason": "This statement about the 'Enabling Act' and 'Hitler's government' is unrelated to Swiss education relocation or conscription."
                        },
                        {
                            "statement": "The Nazis raided their cottage and confiscated Einstein's personal sailboat.",
                            "verdict": "no",
                            "reason": "This statement about 'cottage raids' and 'sailboat confiscation' has nothing to do with Swiss education relocation or conscription."
                        },
                        {
                            "statement": "Upon landing in Antwerp, Belgium on 28 March, Einstein immediately went to the German consulate and surrendered his passport, formally renouncing his German citizenship.",
                            "verdict": "no",
                            "reason": "While this statement mentions Einstein's 'renouncing his German citizenship', it occurred in 1933 in Belgium due to Nazi persecution, not due to 'Swiss education relocation' or for 'conscription' reasons as asked in the input."
                        },
                        {
                            "statement": "The Nazis later sold his boat and converted his cottage into a Hitler Youth camp.",
                            "verdict": "no",
                            "reason": "This statement about the Nazis 'selling his boat' and 'converting his cottage into a Hitler Youth camp' is unrelated to Swiss education relocation or conscription."
                        }
                    ]
                }
            ],
            "token_usage": {
                "prompt_tokens": 1625,
                "completion_tokens": 127,
                "cache_creation_input_tokens": 0,
                "cache_read_input_tokens": 0,
                "turn_name": null,
                "model_name": "apac.anthropic.claude-sonnet-4-20250514-v1:0"
            }
        }
    }
}